{
  "attempt_schema_id": "edge-imci-holistic-teacher-attempt-v1",
  "generation_run_id": "holistic-noisy-v1-2-1-supplemental-qualification-gpt41-20250414-v1",
  "attempt_id": "holistic-noisy-v1-2-1-supplemental-qualification-gpt41-20250414-v1__azure-gpt41-20250414__phc-noisy-typed-english-v1__prompt-v1-2-1__hpg-064-ear-chronic-discharge-14__attempt-1",
  "request_id": "holistic-noisy-v1-2-1-supplemental-qualification-gpt41-20250414-v1__azure-gpt41-20250414__phc-noisy-typed-english-v1__prompt-v1-2-1__hpg-064-ear-chronic-discharge-14",
  "configuration_id": "azure-gpt41-20250414__phc-noisy-typed-english-v1__prompt-v1-2-1",
  "semantic_case_id": "hpg-064-ear-chronic-discharge-14",
  "status": "PENDING_HUMAN_REVIEW",
  "teacher": {
    "provider": "AZURE_OPENAI",
    "model": "gpt-4.1",
    "snapshot": "2025-04-14"
  },
  "prompt": {
    "strategy_id": "phc-noisy-typed-english-v1",
    "prompt_id": "edge-imci-phc-noisy-typed-english",
    "prompt_version": "1.2.1",
    "prompt_sha256": "d95f127ddd49be9dd4f4df9bf84f83c0cd4085c7a27d9007e95e2451daec8fee"
  },
  "generation_parameters": {
    "sampling_config": {
      "temperature": 0.7
    },
    "max_output_tokens": 2200
  },
  "request_sha256": "1c9da8ee780a2b9e068e62b87fdc1259dc3b5e1c2a73bac1b034d90ac9122dfa",
  "requested_at": "2026-08-23T12:59:04Z",
  "completed_at": "2026-08-23T12:59:11Z",
  "raw_response": "{\"candidate_schema_id\": \"edge-imci-holistic-language-variant-candidate-v1\", \"semantic_case_id\": \"hpg-064-ear-chronic-discharge-14\", \"strategy_id\": \"phc-noisy-typed-english-v1\", \"user_submission\": \"child 18 months. no convulsing now. no convulsions. not lethargic or unconscious. able to drink or breastfeed. does not vomit everything. ear discharge reported 14 days. pus draining from ear. no ear pain. no tender swelling behind ear. has ear problem. no cough or difficult breathing. no diarrhoea. no fever.\", \"fact_evidence\": [{\"fact_id\": \"patient_facts.age_months\", \"evidence_text\": \"child 18 months.\"}, {\"fact_id\": \"danger_signs.convulsing_now\", \"evidence_text\": \"no convulsing now.\"}, {\"fact_id\": \"danger_signs.had_convulsions\", \"evidence_text\": \"no convulsions.\"}, {\"fact_id\": \"danger_signs.lethargic_or_unconscious\", \"evidence_text\": \"not lethargic or unconscious.\"}, {\"fact_id\": \"danger_signs.unable_to_drink_or_breastfeed\", \"evidence_text\": \"able to drink or breastfeed.\"}, {\"fact_id\": \"danger_signs.vomits_everything\", \"evidence_text\": \"does not vomit everything.\"}, {\"fact_id\": \"ear.ear_discharge_reported\", \"evidence_text\": \"ear discharge reported\"}, {\"fact_id\": \"ear.ear_discharge_duration_days\", \"evidence_text\": \"14 days.\"}, {\"fact_id\": \"ear.pus_draining_from_ear\", \"evidence_text\": \"pus draining from ear.\"}, {\"fact_id\": \"ear.ear_pain\", \"evidence_text\": \"no ear pain.\"}, {\"fact_id\": \"ear.tender_swelling_behind_ear\", \"evidence_text\": \"no tender swelling behind ear.\"}, {\"fact_id\": \"patient_facts.has_ear_problem\", \"evidence_text\": \"has ear problem.\"}, {\"fact_id\": \"patient_facts.has_cough_or_difficult_breathing\", \"evidence_text\": \"no cough or difficult breathing.\"}, {\"fact_id\": \"patient_facts.has_diarrhoea\", \"evidence_text\": \"no diarrhoea.\"}, {\"fact_id\": \"patient_facts.has_fever\", \"evidence_text\": \"no fever.\"}]}",
  "candidate": {
    "candidate_schema_id": "edge-imci-holistic-language-variant-candidate-v1",
    "semantic_case_id": "hpg-064-ear-chronic-discharge-14",
    "strategy_id": "phc-noisy-typed-english-v1",
    "user_submission": "child 18 months. no convulsing now. no convulsions. not lethargic or unconscious. able to drink or breastfeed. does not vomit everything. ear discharge reported 14 days. pus draining from ear. no ear pain. no tender swelling behind ear. has ear problem. no cough or difficult breathing. no diarrhoea. no fever.",
    "fact_evidence": [
      {
        "fact_id": "patient_facts.age_months",
        "evidence_text": "child 18 months."
      },
      {
        "fact_id": "danger_signs.convulsing_now",
        "evidence_text": "no convulsing now."
      },
      {
        "fact_id": "danger_signs.had_convulsions",
        "evidence_text": "no convulsions."
      },
      {
        "fact_id": "danger_signs.lethargic_or_unconscious",
        "evidence_text": "not lethargic or unconscious."
      },
      {
        "fact_id": "danger_signs.unable_to_drink_or_breastfeed",
        "evidence_text": "able to drink or breastfeed."
      },
      {
        "fact_id": "danger_signs.vomits_everything",
        "evidence_text": "does not vomit everything."
      },
      {
        "fact_id": "ear.ear_discharge_reported",
        "evidence_text": "ear discharge reported"
      },
      {
        "fact_id": "ear.ear_discharge_duration_days",
        "evidence_text": "14 days."
      },
      {
        "fact_id": "ear.pus_draining_from_ear",
        "evidence_text": "pus draining from ear."
      },
      {
        "fact_id": "ear.ear_pain",
        "evidence_text": "no ear pain."
      },
      {
        "fact_id": "ear.tender_swelling_behind_ear",
        "evidence_text": "no tender swelling behind ear."
      },
      {
        "fact_id": "patient_facts.has_ear_problem",
        "evidence_text": "has ear problem."
      },
      {
        "fact_id": "patient_facts.has_cough_or_difficult_breathing",
        "evidence_text": "no cough or difficult breathing."
      },
      {
        "fact_id": "patient_facts.has_diarrhoea",
        "evidence_text": "no diarrhoea."
      },
      {
        "fact_id": "patient_facts.has_fever",
        "evidence_text": "no fever."
      }
    ]
  },
  "validation": {
    "deterministic_pass": true,
    "error_codes": [],
    "requires_human_semantic_review": true
  },
  "usage": {
    "input_tokens": 1755,
    "output_tokens": 534,
    "cached_input_tokens": 0,
    "latency_ms": 7601,
    "retry_count": 0,
    "provider_request_id": "resp_0b392166276ba184016a8aee990fb48195b842efd17c84a234",
    "raw_usage": {
      "input_tokens": 1755,
      "input_tokens_details": {
        "cache_write_tokens": 0,
        "cached_tokens": 0
      },
      "output_tokens": 534,
      "output_tokens_details": {
        "reasoning_tokens": 0
      },
      "total_tokens": 2289
    }
  }
}
