{
  "attempt_schema_id": "edge-imci-holistic-teacher-attempt-v1",
  "generation_run_id": "structured-extraction-language-bulk-gpt41-20250414-v9",
  "attempt_id": "structured-extraction-language-bulk-gpt41-20250414-v9__azure-gpt41-20250414__phc-nigerian-english-v1__prompt-v1-3-5__hpg-009-resp-age-11-rate-50__variant-0003__attempt-1",
  "request_id": "structured-extraction-language-bulk-gpt41-20250414-v9__azure-gpt41-20250414__phc-nigerian-english-v1__prompt-v1-3-5__hpg-009-resp-age-11-rate-50__variant-0003",
  "configuration_id": "azure-gpt41-20250414__phc-nigerian-english-v1__prompt-v1-3-5",
  "semantic_case_id": "hpg-009-resp-age-11-rate-50",
  "status": "PENDING_HUMAN_REVIEW",
  "teacher": {
    "provider": "AZURE_OPENAI",
    "model": "gpt-4.1",
    "snapshot": "2025-04-14"
  },
  "prompt": {
    "strategy_id": "phc-nigerian-english-v1",
    "prompt_id": "edge-imci-phc-nigerian-english",
    "prompt_version": "1.3.5",
    "prompt_sha256": "9c3c818ab50477c68d43dc51e2319828744ad3e43d79a36c41aff18f6f0750f4"
  },
  "generation_parameters": {
    "sampling_config": {
      "temperature": 0.7
    },
    "max_output_tokens": 2200
  },
  "request_sha256": "b67aec42cdc4a91a36bfa1f141cc2d2ee109f12c98fde29e6009738cb8914c68",
  "requested_at": "2026-08-23T15:20:05Z",
  "completed_at": "2026-08-23T15:20:19Z",
  "raw_response": "{\n  \"candidate_schema_id\": \"edge-imci-holistic-language-variant-candidate-v1\",\n  \"semantic_case_id\": \"hpg-009-resp-age-11-rate-50\",\n  \"strategy_id\": \"phc-nigerian-english-v1\",\n  \"user_submission\": \"The child is not convulsing now. There has been no history of convulsions. The child is not lethargic or unconscious. The child is able to drink or breastfeed. The child does not vomit everything. The child is 11 months old. The child has cough or difficult breathing. The child does not have diarrhoea. The child does not have an ear problem. The child does not have fever. The breaths were counted for one full minute. There is no chest indrawing. The child was calm during the assessment. The cough has been present for 3 days. Pulse oximeter was not available. There is no history of recurrent wheeze. The respiratory rate is 50 breaths per minute. There is no stridor when the child is calm. There is no wheezing.\",\n  \"fact_evidence\": [\n    {\n      \"fact_id\": \"danger_signs.convulsing_now\",\n      \"evidence_text\": \"The child is not convulsing now.\"\n    },\n    {\n      \"fact_id\": \"danger_signs.had_convulsions\",\n      \"evidence_text\": \"There has been no history of convulsions.\"\n    },\n    {\n      \"fact_id\": \"danger_signs.lethargic_or_unconscious\",\n      \"evidence_text\": \"The child is not lethargic or unconscious.\"\n    },\n    {\n      \"fact_id\": \"danger_signs.unable_to_drink_or_breastfeed\",\n      \"evidence_text\": \"The child is able to drink or breastfeed.\"\n    },\n    {\n      \"fact_id\": \"danger_signs.vomits_everything\",\n      \"evidence_text\": \"The child does not vomit everything.\"\n    },\n    {\n      \"fact_id\": \"patient_facts.age_months\",\n      \"evidence_text\": \"The child is 11 months old.\"\n    },\n    {\n      \"fact_id\": \"patient_facts.has_cough_or_difficult_breathing\",\n      \"evidence_text\": \"The child has cough or difficult breathing.\"\n    },\n    {\n      \"fact_id\": \"patient_facts.has_diarrhoea\",\n      \"evidence_text\": \"The child does not have diarrhoea.\"\n    },\n    {\n      \"fact_id\": \"patient_facts.has_ear_problem\",\n      \"evidence_text\": \"The child does not have an ear problem.\"\n    },\n    {\n      \"fact_id\": \"patient_facts.has_fever\",\n      \"evidence_text\": \"The child does not have fever.\"\n    },\n    {\n      \"fact_id\": \"respiratory.breaths_counted_one_minute\",\n      \"evidence_text\": \"The breaths were counted for one full minute.\"\n    },\n    {\n      \"fact_id\": \"respiratory.chest_indrawing\",\n      \"evidence_text\": \"There is no chest indrawing.\"\n    },\n    {\n      \"fact_id\": \"respiratory.child_calm\",\n      \"evidence_text\": \"The child was calm during the assessment.\"\n    },\n    {\n      \"fact_id\": \"respiratory.cough_duration_days\",\n      \"evidence_text\": \"The cough has been present for 3 days.\"\n    },\n    {\n      \"fact_id\": \"respiratory.pulse_oximeter_available\",\n      \"evidence_text\": \"Pulse oximeter was not available.\"\n    },\n    {\n      \"fact_id\": \"respiratory.recurrent_wheeze\",\n      \"evidence_text\": \"There is no history of recurrent wheeze.\"\n    },\n    {\n      \"fact_id\": \"respiratory.respiratory_rate\",\n      \"evidence_text\": \"The respiratory rate is 50 breaths per minute.\"\n    },\n    {\n      \"fact_id\": \"respiratory.stridor_when_calm\",\n      \"evidence_text\": \"There is no stridor when the child is calm.\"\n    },\n    {\n      \"fact_id\": \"respiratory.wheezing\",\n      \"evidence_text\": \"There is no wheezing.\"\n    }\n  ]\n}",
  "candidate": {
    "candidate_schema_id": "edge-imci-holistic-language-variant-candidate-v1",
    "semantic_case_id": "hpg-009-resp-age-11-rate-50",
    "strategy_id": "phc-nigerian-english-v1",
    "user_submission": "The child is not convulsing now. There has been no history of convulsions. The child is not lethargic or unconscious. The child is able to drink or breastfeed. The child does not vomit everything. The child is 11 months old. The child has cough or difficult breathing. The child does not have diarrhoea. The child does not have an ear problem. The child does not have fever. The breaths were counted for one full minute. There is no chest indrawing. The child was calm during the assessment. The cough has been present for 3 days. Pulse oximeter was not available. There is no history of recurrent wheeze. The respiratory rate is 50 breaths per minute. There is no stridor when the child is calm. There is no wheezing.",
    "fact_evidence": [
      {
        "fact_id": "danger_signs.convulsing_now",
        "evidence_text": "The child is not convulsing now."
      },
      {
        "fact_id": "danger_signs.had_convulsions",
        "evidence_text": "There has been no history of convulsions."
      },
      {
        "fact_id": "danger_signs.lethargic_or_unconscious",
        "evidence_text": "The child is not lethargic or unconscious."
      },
      {
        "fact_id": "danger_signs.unable_to_drink_or_breastfeed",
        "evidence_text": "The child is able to drink or breastfeed."
      },
      {
        "fact_id": "danger_signs.vomits_everything",
        "evidence_text": "The child does not vomit everything."
      },
      {
        "fact_id": "patient_facts.age_months",
        "evidence_text": "The child is 11 months old."
      },
      {
        "fact_id": "patient_facts.has_cough_or_difficult_breathing",
        "evidence_text": "The child has cough or difficult breathing."
      },
      {
        "fact_id": "patient_facts.has_diarrhoea",
        "evidence_text": "The child does not have diarrhoea."
      },
      {
        "fact_id": "patient_facts.has_ear_problem",
        "evidence_text": "The child does not have an ear problem."
      },
      {
        "fact_id": "patient_facts.has_fever",
        "evidence_text": "The child does not have fever."
      },
      {
        "fact_id": "respiratory.breaths_counted_one_minute",
        "evidence_text": "The breaths were counted for one full minute."
      },
      {
        "fact_id": "respiratory.chest_indrawing",
        "evidence_text": "There is no chest indrawing."
      },
      {
        "fact_id": "respiratory.child_calm",
        "evidence_text": "The child was calm during the assessment."
      },
      {
        "fact_id": "respiratory.cough_duration_days",
        "evidence_text": "The cough has been present for 3 days."
      },
      {
        "fact_id": "respiratory.pulse_oximeter_available",
        "evidence_text": "Pulse oximeter was not available."
      },
      {
        "fact_id": "respiratory.recurrent_wheeze",
        "evidence_text": "There is no history of recurrent wheeze."
      },
      {
        "fact_id": "respiratory.respiratory_rate",
        "evidence_text": "The respiratory rate is 50 breaths per minute."
      },
      {
        "fact_id": "respiratory.stridor_when_calm",
        "evidence_text": "There is no stridor when the child is calm."
      },
      {
        "fact_id": "respiratory.wheezing",
        "evidence_text": "There is no wheezing."
      }
    ]
  },
  "validation": {
    "deterministic_pass": true,
    "error_codes": [],
    "requires_human_semantic_review": true
  },
  "usage": {
    "input_tokens": 1362,
    "output_tokens": 906,
    "cached_input_tokens": 1152,
    "latency_ms": 13213,
    "retry_count": 0,
    "provider_request_id": "resp_0d932d9126d19c55016a8b0fa6cf708195ac0cd3e7633f1323",
    "raw_usage": {
      "input_tokens": 1362,
      "input_tokens_details": {
        "cache_write_tokens": 0,
        "cached_tokens": 1152
      },
      "output_tokens": 906,
      "output_tokens_details": {
        "reasoning_tokens": 0
      },
      "total_tokens": 2268
    }
  }
}
