{
  "attempt_schema_id": "edge-imci-holistic-teacher-attempt-v1",
  "generation_run_id": "holistic-input-style-pathway-qualification-gpt41-20250414-v3",
  "attempt_id": "holistic-input-style-pathway-qualification-gpt41-20250414-v3__azure-gpt41-20250414__phc-noisy-typed-english-v1__prompt-v1-2-0__hpg-023-resp-child-not-calm__attempt-1",
  "request_id": "holistic-input-style-pathway-qualification-gpt41-20250414-v3__azure-gpt41-20250414__phc-noisy-typed-english-v1__prompt-v1-2-0__hpg-023-resp-child-not-calm",
  "configuration_id": "azure-gpt41-20250414__phc-noisy-typed-english-v1__prompt-v1-2-0",
  "semantic_case_id": "hpg-023-resp-child-not-calm",
  "status": "REQUESTED",
  "teacher": {
    "provider": "AZURE_OPENAI",
    "model": "gpt-4.1",
    "snapshot": "2025-04-14"
  },
  "prompt": {
    "strategy_id": "phc-noisy-typed-english-v1",
    "prompt_id": "edge-imci-phc-noisy-typed-english",
    "prompt_version": "1.2.0",
    "prompt_sha256": "922c20a0d708b14d780f00a2eec872cd7558bf9035d14299ec655ac1ea554009"
  },
  "generation_parameters": {
    "sampling_config": {
      "temperature": 0.7
    },
    "max_output_tokens": 2200
  },
  "request_sha256": "8b706d87e1bded1608e4cfa32d6562da7c365d6c11258f1a92c24d0c7a7c7d86",
  "requested_at": "2026-08-23T12:48:37Z",
  "completed_at": null,
  "raw_response": null,
  "candidate": null,
  "validation": {
    "deterministic_pass": false,
    "error_codes": [],
    "requires_human_semantic_review": true
  },
  "usage": {
    "input_tokens": null,
    "output_tokens": null,
    "cached_input_tokens": null,
    "latency_ms": null,
    "retry_count": 0,
    "provider_request_id": null,
    "raw_usage": null
  }
}
