{
  "attempt_schema_id": "edge-imci-holistic-teacher-attempt-v1",
  "generation_run_id": "structured-extraction-language-bulk-gpt41-20250414-v6",
  "attempt_id": "structured-extraction-language-bulk-gpt41-20250414-v6__azure-gpt41-20250414__phc-nigerian-english-v1__prompt-v1-3-5__hpg-004-danger-had-convulsions__variant-0003__attempt-1",
  "request_id": "structured-extraction-language-bulk-gpt41-20250414-v6__azure-gpt41-20250414__phc-nigerian-english-v1__prompt-v1-3-5__hpg-004-danger-had-convulsions__variant-0003",
  "configuration_id": "azure-gpt41-20250414__phc-nigerian-english-v1__prompt-v1-3-5",
  "semantic_case_id": "hpg-004-danger-had-convulsions",
  "status": "PENDING_HUMAN_REVIEW",
  "teacher": {
    "provider": "AZURE_OPENAI",
    "model": "gpt-4.1",
    "snapshot": "2025-04-14"
  },
  "prompt": {
    "strategy_id": "phc-nigerian-english-v1",
    "prompt_id": "edge-imci-phc-nigerian-english",
    "prompt_version": "1.3.5",
    "prompt_sha256": "9c3c818ab50477c68d43dc51e2319828744ad3e43d79a36c41aff18f6f0750f4"
  },
  "generation_parameters": {
    "sampling_config": {
      "temperature": 0.7
    },
    "max_output_tokens": 2200
  },
  "request_sha256": "3fcf1c68ceba908ff577796a4f30114724ca1d2055dac5e91f79d168ec123ddd",
  "requested_at": "2026-08-23T14:44:12Z",
  "completed_at": "2026-08-23T14:44:20Z",
  "raw_response": "{\n  \"candidate_schema_id\": \"edge-imci-holistic-language-variant-candidate-v1\",\n  \"semantic_case_id\": \"hpg-004-danger-had-convulsions\",\n  \"strategy_id\": \"phc-nigerian-english-v1\",\n  \"user_submission\": \"The child is 18 months old. The child had convulsions. The child is not convulsing now. The child is not lethargic or unconscious. The child is able to drink or breastfeed. The child does not vomit everything. The child does not have cough or difficult breathing. The child does not have diarrhoea. The child does not have an ear problem. The child does not have fever.\",\n  \"fact_evidence\": [\n    {\n      \"fact_id\": \"patient_facts.age_months\",\n      \"evidence_text\": \"The child is 18 months old.\"\n    },\n    {\n      \"fact_id\": \"danger_signs.had_convulsions\",\n      \"evidence_text\": \"The child had convulsions.\"\n    },\n    {\n      \"fact_id\": \"danger_signs.convulsing_now\",\n      \"evidence_text\": \"The child is not convulsing now.\"\n    },\n    {\n      \"fact_id\": \"danger_signs.lethargic_or_unconscious\",\n      \"evidence_text\": \"The child is not lethargic or unconscious.\"\n    },\n    {\n      \"fact_id\": \"danger_signs.unable_to_drink_or_breastfeed\",\n      \"evidence_text\": \"The child is able to drink or breastfeed.\"\n    },\n    {\n      \"fact_id\": \"danger_signs.vomits_everything\",\n      \"evidence_text\": \"The child does not vomit everything.\"\n    },\n    {\n      \"fact_id\": \"patient_facts.has_cough_or_difficult_breathing\",\n      \"evidence_text\": \"The child does not have cough or difficult breathing.\"\n    },\n    {\n      \"fact_id\": \"patient_facts.has_diarrhoea\",\n      \"evidence_text\": \"The child does not have diarrhoea.\"\n    },\n    {\n      \"fact_id\": \"patient_facts.has_ear_problem\",\n      \"evidence_text\": \"The child does not have an ear problem.\"\n    },\n    {\n      \"fact_id\": \"patient_facts.has_fever\",\n      \"evidence_text\": \"The child does not have fever.\"\n    }\n  ]\n}",
  "candidate": {
    "candidate_schema_id": "edge-imci-holistic-language-variant-candidate-v1",
    "semantic_case_id": "hpg-004-danger-had-convulsions",
    "strategy_id": "phc-nigerian-english-v1",
    "user_submission": "The child is 18 months old. The child had convulsions. The child is not convulsing now. The child is not lethargic or unconscious. The child is able to drink or breastfeed. The child does not vomit everything. The child does not have cough or difficult breathing. The child does not have diarrhoea. The child does not have an ear problem. The child does not have fever.",
    "fact_evidence": [
      {
        "fact_id": "patient_facts.age_months",
        "evidence_text": "The child is 18 months old."
      },
      {
        "fact_id": "danger_signs.had_convulsions",
        "evidence_text": "The child had convulsions."
      },
      {
        "fact_id": "danger_signs.convulsing_now",
        "evidence_text": "The child is not convulsing now."
      },
      {
        "fact_id": "danger_signs.lethargic_or_unconscious",
        "evidence_text": "The child is not lethargic or unconscious."
      },
      {
        "fact_id": "danger_signs.unable_to_drink_or_breastfeed",
        "evidence_text": "The child is able to drink or breastfeed."
      },
      {
        "fact_id": "danger_signs.vomits_everything",
        "evidence_text": "The child does not vomit everything."
      },
      {
        "fact_id": "patient_facts.has_cough_or_difficult_breathing",
        "evidence_text": "The child does not have cough or difficult breathing."
      },
      {
        "fact_id": "patient_facts.has_diarrhoea",
        "evidence_text": "The child does not have diarrhoea."
      },
      {
        "fact_id": "patient_facts.has_ear_problem",
        "evidence_text": "The child does not have an ear problem."
      },
      {
        "fact_id": "patient_facts.has_fever",
        "evidence_text": "The child does not have fever."
      }
    ]
  },
  "validation": {
    "deterministic_pass": true,
    "error_codes": [],
    "requires_human_semantic_review": true
  },
  "usage": {
    "input_tokens": 1113,
    "output_tokens": 514,
    "cached_input_tokens": 0,
    "latency_ms": 8572,
    "retry_count": 0,
    "provider_request_id": "resp_0a814eee9c8d0989016a8b073c906c81909ef7c0a6c1786cb3",
    "raw_usage": {
      "input_tokens": 1113,
      "input_tokens_details": {
        "cache_write_tokens": 0,
        "cached_tokens": 0
      },
      "output_tokens": 514,
      "output_tokens_details": {
        "reasoning_tokens": 0
      },
      "total_tokens": 1627
    }
  }
}
