{
  "attempt_schema_id": "edge-imci-holistic-teacher-attempt-v1",
  "generation_run_id": "structured-extraction-language-bulk-gpt41-20250414-v7",
  "attempt_id": "structured-extraction-language-bulk-gpt41-20250414-v7__azure-gpt41-20250414__phc-nigerian-english-v1__prompt-v1-3-5__hpg-008-resp-age-2-rate-50__variant-0003__attempt-1",
  "request_id": "structured-extraction-language-bulk-gpt41-20250414-v7__azure-gpt41-20250414__phc-nigerian-english-v1__prompt-v1-3-5__hpg-008-resp-age-2-rate-50__variant-0003",
  "configuration_id": "azure-gpt41-20250414__phc-nigerian-english-v1__prompt-v1-3-5",
  "semantic_case_id": "hpg-008-resp-age-2-rate-50",
  "status": "REQUESTED",
  "teacher": {
    "provider": "AZURE_OPENAI",
    "model": "gpt-4.1",
    "snapshot": "2025-04-14"
  },
  "prompt": {
    "strategy_id": "phc-nigerian-english-v1",
    "prompt_id": "edge-imci-phc-nigerian-english",
    "prompt_version": "1.3.5",
    "prompt_sha256": "9c3c818ab50477c68d43dc51e2319828744ad3e43d79a36c41aff18f6f0750f4"
  },
  "generation_parameters": {
    "sampling_config": {
      "temperature": 0.7
    },
    "max_output_tokens": 2200
  },
  "request_sha256": "0553cc58b9354fcce5208ded347f3c25af4912dc18183f5dc2a55302bba0da9e",
  "requested_at": "2026-08-23T14:56:37Z",
  "completed_at": null,
  "raw_response": null,
  "candidate": null,
  "validation": {
    "deterministic_pass": false,
    "error_codes": [],
    "requires_human_semantic_review": true
  },
  "usage": {
    "input_tokens": null,
    "output_tokens": null,
    "cached_input_tokens": null,
    "latency_ms": null,
    "retry_count": 0,
    "provider_request_id": null,
    "raw_usage": null
  }
}
