{
  "attempt_schema_id": "edge-imci-holistic-teacher-attempt-v1",
  "generation_run_id": "structured-extraction-language-bulk-gpt41-20250414-v16",
  "attempt_id": "structured-extraction-language-bulk-gpt41-20250414-v16__azure-gpt41-20250414__phc-noisy-typed-english-v1__prompt-v1-2-16__hpg-019-resp-recurrent-wheeze__variant-0006__attempt-1",
  "request_id": "structured-extraction-language-bulk-gpt41-20250414-v16__azure-gpt41-20250414__phc-noisy-typed-english-v1__prompt-v1-2-16__hpg-019-resp-recurrent-wheeze__variant-0006",
  "configuration_id": "azure-gpt41-20250414__phc-noisy-typed-english-v1__prompt-v1-2-16",
  "semantic_case_id": "hpg-019-resp-recurrent-wheeze",
  "status": "REQUESTED",
  "teacher": {
    "provider": "AZURE_OPENAI",
    "model": "gpt-4.1",
    "snapshot": "2025-04-14"
  },
  "prompt": {
    "strategy_id": "phc-noisy-typed-english-v1",
    "prompt_id": "edge-imci-phc-noisy-typed-english",
    "prompt_version": "1.2.16",
    "prompt_sha256": "e2310aa197ae0496e7f8773dc81ba1e7be4a8a1dad962314849cd15553e4dd01"
  },
  "generation_parameters": {
    "sampling_config": {
      "temperature": 0.1
    },
    "max_output_tokens": 2200
  },
  "request_sha256": "8370d401238664d9a1942e58f667055a08b2e2438ef506a6da45ecda23635b95",
  "requested_at": "2026-08-23T16:25:14Z",
  "completed_at": null,
  "raw_response": null,
  "candidate": null,
  "validation": {
    "deterministic_pass": false,
    "error_codes": [],
    "requires_human_semantic_review": true
  },
  "usage": {
    "input_tokens": null,
    "output_tokens": null,
    "cached_input_tokens": null,
    "latency_ms": null,
    "retry_count": 0,
    "provider_request_id": null,
    "raw_usage": null
  }
}
