{
  "attempt_schema_id": "edge-imci-holistic-teacher-attempt-v1",
  "generation_run_id": "structured-extraction-language-bulk-gpt41-20250414-v3",
  "attempt_id": "structured-extraction-language-bulk-gpt41-20250414-v3__azure-gpt41-20250414__phc-nigerian-english-v1__prompt-v1-3-1__hpg-071-incomplete-entry-unknown__variant-0001__attempt-1",
  "request_id": "structured-extraction-language-bulk-gpt41-20250414-v3__azure-gpt41-20250414__phc-nigerian-english-v1__prompt-v1-3-1__hpg-071-incomplete-entry-unknown__variant-0001",
  "configuration_id": "azure-gpt41-20250414__phc-nigerian-english-v1__prompt-v1-3-1",
  "semantic_case_id": "hpg-071-incomplete-entry-unknown",
  "status": "REQUESTED",
  "teacher": {
    "provider": "AZURE_OPENAI",
    "model": "gpt-4.1",
    "snapshot": "2025-04-14"
  },
  "prompt": {
    "strategy_id": "phc-nigerian-english-v1",
    "prompt_id": "edge-imci-phc-nigerian-english",
    "prompt_version": "1.3.1",
    "prompt_sha256": "ecc08d6cdb55dfcfc84f8e9a62dc5d75175b0a608a450d2e28a11621976051aa"
  },
  "generation_parameters": {
    "sampling_config": {
      "temperature": 0.7
    },
    "max_output_tokens": 2200
  },
  "request_sha256": "2447c23756a87e7fff7f711911ac91fe7d7c59d0388dae9873f86c214653d646",
  "requested_at": "2026-08-23T13:28:39Z",
  "completed_at": null,
  "raw_response": null,
  "candidate": null,
  "validation": {
    "deterministic_pass": false,
    "error_codes": [],
    "requires_human_semantic_review": true
  },
  "usage": {
    "input_tokens": null,
    "output_tokens": null,
    "cached_input_tokens": null,
    "latency_ms": null,
    "retry_count": 0,
    "provider_request_id": null,
    "raw_usage": null
  }
}
