{
  "attempt_schema_id": "edge-imci-holistic-teacher-attempt-v1",
  "generation_run_id": "structured-extraction-language-bulk-gpt41-20250414-v1",
  "attempt_id": "structured-extraction-language-bulk-gpt41-20250414-v1__azure-gpt41-20250414__phc-nigerian-pidgin-v1__prompt-v1-2-1__hpg-019-resp-recurrent-wheeze__variant-0001__attempt-1",
  "request_id": "structured-extraction-language-bulk-gpt41-20250414-v1__azure-gpt41-20250414__phc-nigerian-pidgin-v1__prompt-v1-2-1__hpg-019-resp-recurrent-wheeze__variant-0001",
  "configuration_id": "azure-gpt41-20250414__phc-nigerian-pidgin-v1__prompt-v1-2-1",
  "semantic_case_id": "hpg-019-resp-recurrent-wheeze",
  "status": "REQUESTED",
  "teacher": {
    "provider": "AZURE_OPENAI",
    "model": "gpt-4.1",
    "snapshot": "2025-04-14"
  },
  "prompt": {
    "strategy_id": "phc-nigerian-pidgin-v1",
    "prompt_id": "edge-imci-phc-nigerian-pidgin",
    "prompt_version": "1.2.1",
    "prompt_sha256": "10faa12984776ec9ada0b5d7d8a0740216fc51b775b0845abc7d8e9c196e8c48"
  },
  "generation_parameters": {
    "sampling_config": {
      "temperature": 0.7
    },
    "max_output_tokens": 2200
  },
  "request_sha256": "db92cf837c7c261fd3522ac95d3c4bdc3d6a3a06bf1a0824b7680ba8d6221aae",
  "requested_at": "2026-08-23T13:15:00Z",
  "completed_at": null,
  "raw_response": null,
  "candidate": null,
  "validation": {
    "deterministic_pass": false,
    "error_codes": [],
    "requires_human_semantic_review": true
  },
  "usage": {
    "input_tokens": null,
    "output_tokens": null,
    "cached_input_tokens": null,
    "latency_ms": null,
    "retry_count": 0,
    "provider_request_id": null,
    "raw_usage": null
  }
}
