{
  "attempt_schema_id": "edge-imci-holistic-teacher-attempt-v1",
  "generation_run_id": "structured-extraction-language-bulk-gpt41-20250414-v6",
  "attempt_id": "structured-extraction-language-bulk-gpt41-20250414-v6__azure-gpt41-20250414__phc-nigerian-pidgin-v1__prompt-v1-2-5__hpg-011-resp-age-12-rate-40__variant-0002__attempt-1",
  "request_id": "structured-extraction-language-bulk-gpt41-20250414-v6__azure-gpt41-20250414__phc-nigerian-pidgin-v1__prompt-v1-2-5__hpg-011-resp-age-12-rate-40__variant-0002",
  "configuration_id": "azure-gpt41-20250414__phc-nigerian-pidgin-v1__prompt-v1-2-5",
  "semantic_case_id": "hpg-011-resp-age-12-rate-40",
  "status": "PENDING_HUMAN_REVIEW",
  "teacher": {
    "provider": "AZURE_OPENAI",
    "model": "gpt-4.1",
    "snapshot": "2025-04-14"
  },
  "prompt": {
    "strategy_id": "phc-nigerian-pidgin-v1",
    "prompt_id": "edge-imci-phc-nigerian-pidgin",
    "prompt_version": "1.2.5",
    "prompt_sha256": "f07e9245f64561f39862d077fcd69bb5f969d5f54ca39a534305397f1d739ca9"
  },
  "generation_parameters": {
    "sampling_config": {
      "temperature": 0.7
    },
    "max_output_tokens": 2200
  },
  "request_sha256": "b75dfd427cb47efcd7d7ec5a9f864410de03fa84d4f64921c46b9463c207991f",
  "requested_at": "2026-08-23T14:42:40Z",
  "completed_at": "2026-08-23T14:42:51Z",
  "raw_response": "{\n  \"candidate_schema_id\": \"edge-imci-holistic-language-variant-candidate-v1\",\n  \"semantic_case_id\": \"hpg-011-resp-age-12-rate-40\",\n  \"strategy_id\": \"phc-nigerian-pidgin-v1\",\n  \"user_submission\": \"Pikin no dey get convulsion now. Pikin never get convulsion before. Pikin no dey lethargic and e dey conscious. Pikin fit drink or breastfeed. Pikin no dey vomit everything. Pikin na 12 months old. Pikin dey cough or get wahala to breathe. Pikin no get diarrhoea. Pikin no get ear problem. Pikin no get fever. I count pikin breathe for one full minute. Pikin chest no dey sink inside when e dey breathe. Pikin dey calm when I check am. Pikin don dey cough for 3 days. Pulse oximeter no dey available. Pikin no dey get recurrent wheeze. Pikin dey breathe 40 times for one minute. Pikin no get stridor when e dey calm. Pikin no dey wheeze.\",\n  \"fact_evidence\": [\n    {\n      \"fact_id\": \"danger_signs.convulsing_now\",\n      \"evidence_text\": \"Pikin no dey get convulsion now.\"\n    },\n    {\n      \"fact_id\": \"danger_signs.had_convulsions\",\n      \"evidence_text\": \"Pikin never get convulsion before.\"\n    },\n    {\n      \"fact_id\": \"danger_signs.lethargic_or_unconscious\",\n      \"evidence_text\": \"Pikin no dey lethargic and e dey conscious.\"\n    },\n    {\n      \"fact_id\": \"danger_signs.unable_to_drink_or_breastfeed\",\n      \"evidence_text\": \"Pikin fit drink or breastfeed.\"\n    },\n    {\n      \"fact_id\": \"danger_signs.vomits_everything\",\n      \"evidence_text\": \"Pikin no dey vomit everything.\"\n    },\n    {\n      \"fact_id\": \"patient_facts.age_months\",\n      \"evidence_text\": \"Pikin na 12 months old.\"\n    },\n    {\n      \"fact_id\": \"patient_facts.has_cough_or_difficult_breathing\",\n      \"evidence_text\": \"Pikin dey cough or get wahala to breathe.\"\n    },\n    {\n      \"fact_id\": \"patient_facts.has_diarrhoea\",\n      \"evidence_text\": \"Pikin no get diarrhoea.\"\n    },\n    {\n      \"fact_id\": \"patient_facts.has_ear_problem\",\n      \"evidence_text\": \"Pikin no get ear problem.\"\n    },\n    {\n      \"fact_id\": \"patient_facts.has_fever\",\n      \"evidence_text\": \"Pikin no get fever.\"\n    },\n    {\n      \"fact_id\": \"respiratory.breaths_counted_one_minute\",\n      \"evidence_text\": \"I count pikin breathe for one full minute.\"\n    },\n    {\n      \"fact_id\": \"respiratory.chest_indrawing\",\n      \"evidence_text\": \"Pikin chest no dey sink inside when e dey breathe.\"\n    },\n    {\n      \"fact_id\": \"respiratory.child_calm\",\n      \"evidence_text\": \"Pikin dey calm when I check am.\"\n    },\n    {\n      \"fact_id\": \"respiratory.cough_duration_days\",\n      \"evidence_text\": \"Pikin don dey cough for 3 days.\"\n    },\n    {\n      \"fact_id\": \"respiratory.pulse_oximeter_available\",\n      \"evidence_text\": \"Pulse oximeter no dey available.\"\n    },\n    {\n      \"fact_id\": \"respiratory.recurrent_wheeze\",\n      \"evidence_text\": \"Pikin no dey get recurrent wheeze.\"\n    },\n    {\n      \"fact_id\": \"respiratory.respiratory_rate\",\n      \"evidence_text\": \"Pikin dey breathe 40 times for one minute.\"\n    },\n    {\n      \"fact_id\": \"respiratory.stridor_when_calm\",\n      \"evidence_text\": \"Pikin no get stridor when e dey calm.\"\n    },\n    {\n      \"fact_id\": \"respiratory.wheezing\",\n      \"evidence_text\": \"Pikin no dey wheeze.\"\n    }\n  ]\n}",
  "candidate": {
    "candidate_schema_id": "edge-imci-holistic-language-variant-candidate-v1",
    "semantic_case_id": "hpg-011-resp-age-12-rate-40",
    "strategy_id": "phc-nigerian-pidgin-v1",
    "user_submission": "Pikin no dey get convulsion now. Pikin never get convulsion before. Pikin no dey lethargic and e dey conscious. Pikin fit drink or breastfeed. Pikin no dey vomit everything. Pikin na 12 months old. Pikin dey cough or get wahala to breathe. Pikin no get diarrhoea. Pikin no get ear problem. Pikin no get fever. I count pikin breathe for one full minute. Pikin chest no dey sink inside when e dey breathe. Pikin dey calm when I check am. Pikin don dey cough for 3 days. Pulse oximeter no dey available. Pikin no dey get recurrent wheeze. Pikin dey breathe 40 times for one minute. Pikin no get stridor when e dey calm. Pikin no dey wheeze.",
    "fact_evidence": [
      {
        "fact_id": "danger_signs.convulsing_now",
        "evidence_text": "Pikin no dey get convulsion now."
      },
      {
        "fact_id": "danger_signs.had_convulsions",
        "evidence_text": "Pikin never get convulsion before."
      },
      {
        "fact_id": "danger_signs.lethargic_or_unconscious",
        "evidence_text": "Pikin no dey lethargic and e dey conscious."
      },
      {
        "fact_id": "danger_signs.unable_to_drink_or_breastfeed",
        "evidence_text": "Pikin fit drink or breastfeed."
      },
      {
        "fact_id": "danger_signs.vomits_everything",
        "evidence_text": "Pikin no dey vomit everything."
      },
      {
        "fact_id": "patient_facts.age_months",
        "evidence_text": "Pikin na 12 months old."
      },
      {
        "fact_id": "patient_facts.has_cough_or_difficult_breathing",
        "evidence_text": "Pikin dey cough or get wahala to breathe."
      },
      {
        "fact_id": "patient_facts.has_diarrhoea",
        "evidence_text": "Pikin no get diarrhoea."
      },
      {
        "fact_id": "patient_facts.has_ear_problem",
        "evidence_text": "Pikin no get ear problem."
      },
      {
        "fact_id": "patient_facts.has_fever",
        "evidence_text": "Pikin no get fever."
      },
      {
        "fact_id": "respiratory.breaths_counted_one_minute",
        "evidence_text": "I count pikin breathe for one full minute."
      },
      {
        "fact_id": "respiratory.chest_indrawing",
        "evidence_text": "Pikin chest no dey sink inside when e dey breathe."
      },
      {
        "fact_id": "respiratory.child_calm",
        "evidence_text": "Pikin dey calm when I check am."
      },
      {
        "fact_id": "respiratory.cough_duration_days",
        "evidence_text": "Pikin don dey cough for 3 days."
      },
      {
        "fact_id": "respiratory.pulse_oximeter_available",
        "evidence_text": "Pulse oximeter no dey available."
      },
      {
        "fact_id": "respiratory.recurrent_wheeze",
        "evidence_text": "Pikin no dey get recurrent wheeze."
      },
      {
        "fact_id": "respiratory.respiratory_rate",
        "evidence_text": "Pikin dey breathe 40 times for one minute."
      },
      {
        "fact_id": "respiratory.stridor_when_calm",
        "evidence_text": "Pikin no get stridor when e dey calm."
      },
      {
        "fact_id": "respiratory.wheezing",
        "evidence_text": "Pikin no dey wheeze."
      }
    ]
  },
  "validation": {
    "deterministic_pass": true,
    "error_codes": [],
    "requires_human_semantic_review": true
  },
  "usage": {
    "input_tokens": 1303,
    "output_tokens": 921,
    "cached_input_tokens": 0,
    "latency_ms": 10969,
    "retry_count": 0,
    "provider_request_id": "resp_02ebb9b3a6844a7d016a8b06e169ec81958e1d6f966a360b0d",
    "raw_usage": {
      "input_tokens": 1303,
      "input_tokens_details": {
        "cache_write_tokens": 0,
        "cached_tokens": 0
      },
      "output_tokens": 921,
      "output_tokens_details": {
        "reasoning_tokens": 0
      },
      "total_tokens": 2224
    }
  }
}
