{
  "attempt_schema_id": "edge-imci-holistic-teacher-attempt-v1",
  "generation_run_id": "structured-extraction-language-bulk-gpt41-20250414-v4",
  "attempt_id": "structured-extraction-language-bulk-gpt41-20250414-v4__azure-gpt41-20250414__phc-nigerian-english-v1__prompt-v1-3-4__hpg-044-fever-low-obvious-cause__variant-0002__attempt-1",
  "request_id": "structured-extraction-language-bulk-gpt41-20250414-v4__azure-gpt41-20250414__phc-nigerian-english-v1__prompt-v1-3-4__hpg-044-fever-low-obvious-cause__variant-0002",
  "configuration_id": "azure-gpt41-20250414__phc-nigerian-english-v1__prompt-v1-3-4",
  "semantic_case_id": "hpg-044-fever-low-obvious-cause",
  "status": "REQUESTED",
  "teacher": {
    "provider": "AZURE_OPENAI",
    "model": "gpt-4.1",
    "snapshot": "2025-04-14"
  },
  "prompt": {
    "strategy_id": "phc-nigerian-english-v1",
    "prompt_id": "edge-imci-phc-nigerian-english",
    "prompt_version": "1.3.4",
    "prompt_sha256": "49ea6882894e92d54cde164520ec77b832ad44b5d8affd3ad26c015a300165b8"
  },
  "generation_parameters": {
    "sampling_config": {
      "temperature": 0.7
    },
    "max_output_tokens": 2200
  },
  "request_sha256": "281c2ae8e693271e3e09e6bad3d24018ca33c0922ffdcaf246722216cd7746b7",
  "requested_at": "2026-08-23T14:11:32Z",
  "completed_at": null,
  "raw_response": null,
  "candidate": null,
  "validation": {
    "deterministic_pass": false,
    "error_codes": [],
    "requires_human_semantic_review": true
  },
  "usage": {
    "input_tokens": null,
    "output_tokens": null,
    "cached_input_tokens": null,
    "latency_ms": null,
    "retry_count": 0,
    "provider_request_id": null,
    "raw_usage": null
  }
}
