{
  "attempt_schema_id": "edge-imci-holistic-teacher-attempt-v1",
  "generation_run_id": "structured-extraction-language-bulk-gpt41-20250414-v4",
  "attempt_id": "structured-extraction-language-bulk-gpt41-20250414-v4__azure-gpt41-20250414__phc-nigerian-pidgin-v1__prompt-v1-2-3__hpg-049-fever-duration-7__variant-0002__attempt-1",
  "request_id": "structured-extraction-language-bulk-gpt41-20250414-v4__azure-gpt41-20250414__phc-nigerian-pidgin-v1__prompt-v1-2-3__hpg-049-fever-duration-7__variant-0002",
  "configuration_id": "azure-gpt41-20250414__phc-nigerian-pidgin-v1__prompt-v1-2-3",
  "semantic_case_id": "hpg-049-fever-duration-7",
  "status": "PENDING_HUMAN_REVIEW",
  "teacher": {
    "provider": "AZURE_OPENAI",
    "model": "gpt-4.1",
    "snapshot": "2025-04-14"
  },
  "prompt": {
    "strategy_id": "phc-nigerian-pidgin-v1",
    "prompt_id": "edge-imci-phc-nigerian-pidgin",
    "prompt_version": "1.2.3",
    "prompt_sha256": "4a7cbb1b70324336eb0d3cfb252ce00c1e2f18c299d3004b71d96fc17d9fe348"
  },
  "generation_parameters": {
    "sampling_config": {
      "temperature": 0.7
    },
    "max_output_tokens": 2200
  },
  "request_sha256": "883adefb63ba2335de4d51b281946369ba3cbea08b3eaaf291c951d06ea684bf",
  "requested_at": "2026-08-23T14:07:34Z",
  "completed_at": "2026-08-23T14:07:42Z",
  "raw_response": "{\n  \"candidate_schema_id\": \"edge-imci-holistic-language-variant-candidate-v1\",\n  \"semantic_case_id\": \"hpg-049-fever-duration-7\",\n  \"strategy_id\": \"phc-nigerian-pidgin-v1\",\n  \"user_submission\": \"Di pikin no dey convulse now. Di pikin never convulse before. Di pikin no dey weak or dey unconscious. Di pikin fit drink or breastfeed. Di pikin no dey vomit everything. Di fever don last for 7 days. Di pikin no get rash wey spread for body. Dem no identify bacterial cause for this assessment. Di area na high malaria risk. Malaria test dey available. Di malaria test show negative. Di pikin no get cough wey join measles. Di pikin never get measles for di last three months. Dem no see any obvious cause for di fever. Di pikin eye no red. Di pikin nose no dey run. Di pikin neck no stiff. Dem check temperature, e dey 38.0°C. Di pikin na 18 months old. Di pikin no get cough or dey breathe hard. Di pikin no get diarrhoea. Di pikin no get ear wahala. Di pikin get fever.\",\n  \"fact_evidence\": [\n    {\"fact_id\": \"danger_signs.convulsing_now\", \"evidence_text\": \"Di pikin no dey convulse now.\"},\n    {\"fact_id\": \"danger_signs.had_convulsions\", \"evidence_text\": \"Di pikin never convulse before.\"},\n    {\"fact_id\": \"danger_signs.lethargic_or_unconscious\", \"evidence_text\": \"Di pikin no dey weak or dey unconscious.\"},\n    {\"fact_id\": \"danger_signs.unable_to_drink_or_breastfeed\", \"evidence_text\": \"Di pikin fit drink or breastfeed.\"},\n    {\"fact_id\": \"danger_signs.vomits_everything\", \"evidence_text\": \"Di pikin no dey vomit everything.\"},\n    {\"fact_id\": \"fever.fever_duration_days\", \"evidence_text\": \"Di fever don last for 7 days.\"},\n    {\"fact_id\": \"fever.generalized_rash\", \"evidence_text\": \"Di pikin no get rash wey spread for body.\"},\n    {\"fact_id\": \"fever.identified_bacterial_cause_present\", \"evidence_text\": \"Dem no identify bacterial cause for this assessment.\"},\n    {\"fact_id\": \"fever.malaria_risk\", \"evidence_text\": \"Di area na high malaria risk.\"},\n    {\"fact_id\": \"fever.malaria_test_available\", \"evidence_text\": \"Malaria test dey available.\"},\n    {\"fact_id\": \"fever.malaria_test_result\", \"evidence_text\": \"Di malaria test show negative.\"},\n    {\"fact_id\": \"fever.measles_cough\", \"evidence_text\": \"Di pikin no get cough wey join measles.\"},\n    {\"fact_id\": \"fever.measles_within_last_3_months\", \"evidence_text\": \"Di pikin never get measles for di last three months.\"},\n    {\"fact_id\": \"fever.obvious_cause_of_fever_present\", \"evidence_text\": \"Dem no see any obvious cause for di fever.\"},\n    {\"fact_id\": \"fever.red_eyes\", \"evidence_text\": \"Di pikin eye no red.\"},\n    {\"fact_id\": \"fever.runny_nose\", \"evidence_text\": \"Di pikin nose no dey run.\"},\n    {\"fact_id\": \"fever.stiff_neck\", \"evidence_text\": \"Di pikin neck no stiff.\"},\n    {\"fact_id\": \"fever.temperature_c\", \"evidence_text\": \"Dem check temperature, e dey 38.0°C.\"},\n    {\"fact_id\": \"patient_facts.age_months\", \"evidence_text\": \"Di pikin na 18 months old.\"},\n    {\"fact_id\": \"patient_facts.has_cough_or_difficult_breathing\", \"evidence_text\": \"Di pikin no get cough or dey breathe hard.\"},\n    {\"fact_id\": \"patient_facts.has_diarrhoea\", \"evidence_text\": \"Di pikin no get diarrhoea.\"},\n    {\"fact_id\": \"patient_facts.has_ear_problem\", \"evidence_text\": \"Di pikin no get ear wahala.\"},\n    {\"fact_id\": \"patient_facts.has_fever\", \"evidence_text\": \"Di pikin get fever.\"}\n  ]\n}",
  "candidate": {
    "candidate_schema_id": "edge-imci-holistic-language-variant-candidate-v1",
    "semantic_case_id": "hpg-049-fever-duration-7",
    "strategy_id": "phc-nigerian-pidgin-v1",
    "user_submission": "Di pikin no dey convulse now. Di pikin never convulse before. Di pikin no dey weak or dey unconscious. Di pikin fit drink or breastfeed. Di pikin no dey vomit everything. Di fever don last for 7 days. Di pikin no get rash wey spread for body. Dem no identify bacterial cause for this assessment. Di area na high malaria risk. Malaria test dey available. Di malaria test show negative. Di pikin no get cough wey join measles. Di pikin never get measles for di last three months. Dem no see any obvious cause for di fever. Di pikin eye no red. Di pikin nose no dey run. Di pikin neck no stiff. Dem check temperature, e dey 38.0°C. Di pikin na 18 months old. Di pikin no get cough or dey breathe hard. Di pikin no get diarrhoea. Di pikin no get ear wahala. Di pikin get fever.",
    "fact_evidence": [
      {
        "fact_id": "danger_signs.convulsing_now",
        "evidence_text": "Di pikin no dey convulse now."
      },
      {
        "fact_id": "danger_signs.had_convulsions",
        "evidence_text": "Di pikin never convulse before."
      },
      {
        "fact_id": "danger_signs.lethargic_or_unconscious",
        "evidence_text": "Di pikin no dey weak or dey unconscious."
      },
      {
        "fact_id": "danger_signs.unable_to_drink_or_breastfeed",
        "evidence_text": "Di pikin fit drink or breastfeed."
      },
      {
        "fact_id": "danger_signs.vomits_everything",
        "evidence_text": "Di pikin no dey vomit everything."
      },
      {
        "fact_id": "fever.fever_duration_days",
        "evidence_text": "Di fever don last for 7 days."
      },
      {
        "fact_id": "fever.generalized_rash",
        "evidence_text": "Di pikin no get rash wey spread for body."
      },
      {
        "fact_id": "fever.identified_bacterial_cause_present",
        "evidence_text": "Dem no identify bacterial cause for this assessment."
      },
      {
        "fact_id": "fever.malaria_risk",
        "evidence_text": "Di area na high malaria risk."
      },
      {
        "fact_id": "fever.malaria_test_available",
        "evidence_text": "Malaria test dey available."
      },
      {
        "fact_id": "fever.malaria_test_result",
        "evidence_text": "Di malaria test show negative."
      },
      {
        "fact_id": "fever.measles_cough",
        "evidence_text": "Di pikin no get cough wey join measles."
      },
      {
        "fact_id": "fever.measles_within_last_3_months",
        "evidence_text": "Di pikin never get measles for di last three months."
      },
      {
        "fact_id": "fever.obvious_cause_of_fever_present",
        "evidence_text": "Dem no see any obvious cause for di fever."
      },
      {
        "fact_id": "fever.red_eyes",
        "evidence_text": "Di pikin eye no red."
      },
      {
        "fact_id": "fever.runny_nose",
        "evidence_text": "Di pikin nose no dey run."
      },
      {
        "fact_id": "fever.stiff_neck",
        "evidence_text": "Di pikin neck no stiff."
      },
      {
        "fact_id": "fever.temperature_c",
        "evidence_text": "Dem check temperature, e dey 38.0°C."
      },
      {
        "fact_id": "patient_facts.age_months",
        "evidence_text": "Di pikin na 18 months old."
      },
      {
        "fact_id": "patient_facts.has_cough_or_difficult_breathing",
        "evidence_text": "Di pikin no get cough or dey breathe hard."
      },
      {
        "fact_id": "patient_facts.has_diarrhoea",
        "evidence_text": "Di pikin no get diarrhoea."
      },
      {
        "fact_id": "patient_facts.has_ear_problem",
        "evidence_text": "Di pikin no get ear wahala."
      },
      {
        "fact_id": "patient_facts.has_fever",
        "evidence_text": "Di pikin get fever."
      }
    ]
  },
  "validation": {
    "deterministic_pass": true,
    "error_codes": [],
    "requires_human_semantic_review": true
  },
  "usage": {
    "input_tokens": 1471,
    "output_tokens": 987,
    "cached_input_tokens": 0,
    "latency_ms": 8108,
    "retry_count": 0,
    "provider_request_id": "resp_095335756bdc97cb016a8afea72c5c8190885b16e02308804b",
    "raw_usage": {
      "input_tokens": 1471,
      "input_tokens_details": {
        "cache_write_tokens": 0,
        "cached_tokens": 0
      },
      "output_tokens": 987,
      "output_tokens_details": {
        "reasoning_tokens": 0
      },
      "total_tokens": 2458
    }
  }
}
