{
  "attempt_schema_id": "edge-imci-holistic-teacher-attempt-v1",
  "generation_run_id": "structured-extraction-language-bulk-gpt41-20250414-v16",
  "attempt_id": "structured-extraction-language-bulk-gpt41-20250414-v16__azure-gpt41-20250414__phc-noisy-typed-english-v1__prompt-v1-2-16__hpg-046-fever-no-risk__variant-0007__attempt-1",
  "request_id": "structured-extraction-language-bulk-gpt41-20250414-v16__azure-gpt41-20250414__phc-noisy-typed-english-v1__prompt-v1-2-16__hpg-046-fever-no-risk__variant-0007",
  "configuration_id": "azure-gpt41-20250414__phc-noisy-typed-english-v1__prompt-v1-2-16",
  "semantic_case_id": "hpg-046-fever-no-risk",
  "status": "PENDING_HUMAN_REVIEW",
  "teacher": {
    "provider": "AZURE_OPENAI",
    "model": "gpt-4.1",
    "snapshot": "2025-04-14"
  },
  "prompt": {
    "strategy_id": "phc-noisy-typed-english-v1",
    "prompt_id": "edge-imci-phc-noisy-typed-english",
    "prompt_version": "1.2.16",
    "prompt_sha256": "e2310aa197ae0496e7f8773dc81ba1e7be4a8a1dad962314849cd15553e4dd01"
  },
  "generation_parameters": {
    "sampling_config": {
      "temperature": 0.1
    },
    "max_output_tokens": 2200
  },
  "request_sha256": "093fc10bbb06b205ebcd2f4fc89571afa2f4bed37ed506d246bd2e78b8e4315a",
  "requested_at": "2026-08-23T16:46:00Z",
  "completed_at": "2026-08-23T16:46:05Z",
  "raw_response": "{\n  \"candidate_schema_id\": \"edge-imci-holistic-language-variant-candidate-v1\",\n  \"semantic_case_id\": \"hpg-046-fever-no-risk\",\n  \"strategy_id\": \"phc-noisy-typed-english-v1\",\n  \"user_submission\": \"pt is 18 months old, has fever for 2 days, temp measured at 38.0C. able to drink or breastfeed, does not vomit everything, no convulsing now, no history of convulsions, not lethargic or unconscious. no cough or difficult breathing, no diarrhoea, no ear problem. no generalized rash, no obvious cause of fever present, no identified bacterial cause, malaria risk is NONE_NO_TRAVEL, no measles cough, no measles within last 3 months, no red eyes, no runny nose, no stiff neck.\",\n  \"fact_evidence\": [\n    {\"fact_id\": \"patient_facts.age_months\", \"evidence_text\": \"pt is 18 months old\"},\n    {\"fact_id\": \"fever.fever_duration_days\", \"evidence_text\": \"has fever for 2 days\"},\n    {\"fact_id\": \"fever.temperature_c\", \"evidence_text\": \"temp measured at 38.0C\"},\n    {\"fact_id\": \"danger_signs.unable_to_drink_or_breastfeed\", \"evidence_text\": \"able to drink or breastfeed\"},\n    {\"fact_id\": \"danger_signs.vomits_everything\", \"evidence_text\": \"does not vomit everything\"},\n    {\"fact_id\": \"danger_signs.convulsing_now\", \"evidence_text\": \"no convulsing now\"},\n    {\"fact_id\": \"danger_signs.had_convulsions\", \"evidence_text\": \"no history of convulsions\"},\n    {\"fact_id\": \"danger_signs.lethargic_or_unconscious\", \"evidence_text\": \"not lethargic or unconscious\"},\n    {\"fact_id\": \"patient_facts.has_cough_or_difficult_breathing\", \"evidence_text\": \"no cough or difficult breathing\"},\n    {\"fact_id\": \"patient_facts.has_diarrhoea\", \"evidence_text\": \"no diarrhoea\"},\n    {\"fact_id\": \"patient_facts.has_ear_problem\", \"evidence_text\": \"no ear problem\"},\n    {\"fact_id\": \"patient_facts.has_fever\", \"evidence_text\": \"has fever\"},\n    {\"fact_id\": \"fever.generalized_rash\", \"evidence_text\": \"no generalized rash\"},\n    {\"fact_id\": \"fever.obvious_cause_of_fever_present\", \"evidence_text\": \"no obvious cause of fever present\"},\n    {\"fact_id\": \"fever.identified_bacterial_cause_present\", \"evidence_text\": \"no identified bacterial cause\"},\n    {\"fact_id\": \"fever.malaria_risk\", \"evidence_text\": \"malaria risk is NONE_NO_TRAVEL\"},\n    {\"fact_id\": \"fever.measles_cough\", \"evidence_text\": \"no measles cough\"},\n    {\"fact_id\": \"fever.measles_within_last_3_months\", \"evidence_text\": \"no measles within last 3 months\"},\n    {\"fact_id\": \"fever.red_eyes\", \"evidence_text\": \"no red eyes\"},\n    {\"fact_id\": \"fever.runny_nose\", \"evidence_text\": \"no runny nose\"},\n    {\"fact_id\": \"fever.stiff_neck\", \"evidence_text\": \"no stiff neck\"}\n  ]\n}",
  "candidate": {
    "candidate_schema_id": "edge-imci-holistic-language-variant-candidate-v1",
    "semantic_case_id": "hpg-046-fever-no-risk",
    "strategy_id": "phc-noisy-typed-english-v1",
    "user_submission": "pt is 18 months old, has fever for 2 days, temp measured at 38.0C. able to drink or breastfeed, does not vomit everything, no convulsing now, no history of convulsions, not lethargic or unconscious. no cough or difficult breathing, no diarrhoea, no ear problem. no generalized rash, no obvious cause of fever present, no identified bacterial cause, malaria risk is NONE_NO_TRAVEL, no measles cough, no measles within last 3 months, no red eyes, no runny nose, no stiff neck.",
    "fact_evidence": [
      {
        "fact_id": "patient_facts.age_months",
        "evidence_text": "pt is 18 months old"
      },
      {
        "fact_id": "fever.fever_duration_days",
        "evidence_text": "has fever for 2 days"
      },
      {
        "fact_id": "fever.temperature_c",
        "evidence_text": "temp measured at 38.0C"
      },
      {
        "fact_id": "danger_signs.unable_to_drink_or_breastfeed",
        "evidence_text": "able to drink or breastfeed"
      },
      {
        "fact_id": "danger_signs.vomits_everything",
        "evidence_text": "does not vomit everything"
      },
      {
        "fact_id": "danger_signs.convulsing_now",
        "evidence_text": "no convulsing now"
      },
      {
        "fact_id": "danger_signs.had_convulsions",
        "evidence_text": "no history of convulsions"
      },
      {
        "fact_id": "danger_signs.lethargic_or_unconscious",
        "evidence_text": "not lethargic or unconscious"
      },
      {
        "fact_id": "patient_facts.has_cough_or_difficult_breathing",
        "evidence_text": "no cough or difficult breathing"
      },
      {
        "fact_id": "patient_facts.has_diarrhoea",
        "evidence_text": "no diarrhoea"
      },
      {
        "fact_id": "patient_facts.has_ear_problem",
        "evidence_text": "no ear problem"
      },
      {
        "fact_id": "patient_facts.has_fever",
        "evidence_text": "has fever"
      },
      {
        "fact_id": "fever.generalized_rash",
        "evidence_text": "no generalized rash"
      },
      {
        "fact_id": "fever.obvious_cause_of_fever_present",
        "evidence_text": "no obvious cause of fever present"
      },
      {
        "fact_id": "fever.identified_bacterial_cause_present",
        "evidence_text": "no identified bacterial cause"
      },
      {
        "fact_id": "fever.malaria_risk",
        "evidence_text": "malaria risk is NONE_NO_TRAVEL"
      },
      {
        "fact_id": "fever.measles_cough",
        "evidence_text": "no measles cough"
      },
      {
        "fact_id": "fever.measles_within_last_3_months",
        "evidence_text": "no measles within last 3 months"
      },
      {
        "fact_id": "fever.red_eyes",
        "evidence_text": "no red eyes"
      },
      {
        "fact_id": "fever.runny_nose",
        "evidence_text": "no runny nose"
      },
      {
        "fact_id": "fever.stiff_neck",
        "evidence_text": "no stiff neck"
      }
    ]
  },
  "validation": {
    "deterministic_pass": true,
    "error_codes": [],
    "requires_human_semantic_review": true
  },
  "usage": {
    "input_tokens": 1473,
    "output_tokens": 757,
    "cached_input_tokens": 1408,
    "latency_ms": 5046,
    "retry_count": 0,
    "provider_request_id": "resp_06feec604301596b016a8b23c94a18819682a6e727015ae71f",
    "raw_usage": {
      "input_tokens": 1473,
      "input_tokens_details": {
        "cache_write_tokens": 0,
        "cached_tokens": 1408
      },
      "output_tokens": 757,
      "output_tokens_details": {
        "reasoning_tokens": 0
      },
      "total_tokens": 2230
    }
  }
}
